id,category,question,auto_label,reasoning,human_label,match
multihop-004,multi-hop,What currency is used in the country that hosted the 2016 Summer Olympics?,PASS,"The response identifies the host country (Brazil), specifies the currency (Brazilian real), provides the currency code (BRL), and includes sources. All aspects of the question are addressed.",PASS,TRUE
multihop-005,multi-hop,What is the population of the city where the Mona Lisa is displayed?,PASS,"The question asks for the population of the city where the Mona Lisa is displayed. The response identifies the city (Paris), provides its population (approximately 15 million in the metropolitan area), and addresses the single aspect requested.",PASS,TRUE
multihop-006,multi-hop,What is the national animal of the country where Mount Everest is located?,PASS,"The question asks for the national animal of the country where Mount Everest is located. The response identifies that Mount Everest is on the Nepal-China border and provides the national animals for both countries (cow for Nepal, giant panda for China), thus addressing all aspects of the question.",PASS,TRUE
multihop-007,multi-hop,What continent is the birthplace of chocolate located on?,PASS,"The response directly answers the question by identifying the continent (North America) where chocolate's birthplace is located, and provides supporting historical context about the Mesoamerican civilizations that originated chocolate cultivation.",PASS,TRUE
multihop-008,multi-hop,Who wrote the national anthem of the country where Big Ben is located?,PASS,"The response addresses all aspects: identifies the country (United Kingdom), names the national anthem ('God Save the King'), and answers who wrote it (unknown/uncertain authorship).",PASS,TRUE
multihop-009,multi-hop,What ocean borders the country that invented sushi?,PASS,"The question asks what ocean borders the country that invented sushi. The response identifies Japan as the country that invented sushi and lists all the bodies of water that border it (Pacific Ocean, Sea of Japan, Sea of Okhotsk), fully addressing the question's single aspect.",PASS,TRUE
multihop-010,multi-hop,What is the GDP of the country where the Amazon River originates?,PASS,"The response addresses both distinct aspects: (1) identifying the country where the Amazon River originates (Peru), and (2) providing the GDP of that country (approximately $230 billion in 2022).",PASS,TRUE
nonsense-001,nonsense,What color is the number 7?,PASS,"The response addresses all aspects: it clarifies that numbers lack inherent color, explains the abstract nature of numbers, acknowledges synesthesia as a condition where some people perceive colors associated with numbers, and notes there is no universal color assignment for the number 7.",PASS,TRUE
nonsense-002,nonsense,How much does a thought weigh?,PASS,"The question asks a straightforward factual question about whether thoughts have weight. The response directly addresses this by explaining that thoughts have no physical weight, clarifying what thoughts are (electrochemical activity), and distinguishing between the brain's physical mass and the non-physical nature of thoughts themselves.",PASS,TRUE
nonsense-003,nonsense,What is the square root of a banana?,PASS,"The question asks 'what is the square root of a banana' which is nonsensical/ambiguous. The response addresses both possible interpretations: (1) treating 'banana' as a fruit and providing information about it, and (2) treating the question as asking for the square root of a banana's weight (120g), yielding ~10.95. All reasonable aspects of this ambiguous question are covered.",PASS,TRUE
nonsense-004,nonsense,asdfkjhasdkfh,PASS,"The response appropriately addresses the input by noting it is not a recognizable question and requesting clarification, which is the complete and appropriate response to nonsensical input.",PASS,TRUE
nonsense-005,nonsense,What time does the color blue start?,FAIL,"The question is ambiguous and could refer to multiple meanings: (1) a literal time-based event (e.g., 'Blue' as a TV show or event start time), (2) a poetic/metaphorical reference, (3) a specific context like 'blue hour' in photography, or (4) a misunderstanding about color physics. The response only addresses the physics interpretation and dismisses other possible meanings without exploring them.",PASS,FALSE
nonsense-006,nonsense,Can silence be louder than noise?,PASS,"The response addresses both the literal/physical aspect (silence as absence of sound with no measurable volume) and the metaphorical/psychological aspect (the impactful experience of sudden silence), which are the two distinct interpretations of this ambiguous question.",PASS,TRUE
nonsense-007,nonsense,How many corners does a circle have?,PASS,"The question asks a single, straightforward question about the number of corners in a circle, and the response directly answers it (zero) with a clear explanation of why.",PASS,TRUE
nonsense-008,nonsense,What does purple taste like?,PASS,"The response addresses all aspects of the question: it clarifies that purple as a color has no inherent taste, explains synesthesia as a phenomenon where colors can evoke tastes, and provides common taste associations with purple in food contexts.",PASS,TRUE
nonsense-009,nonsense,Why do rocks dream?,PASS,"The question is based on a false premise (that rocks dream). The response appropriately addresses this by clarifying that rocks do not dream and explaining why, which completely answers what the question asks about.",PASS,TRUE
nonsense-010,nonsense,What is the meaning of blergflorp?,PASS,"The question asks for the meaning of 'blergflorp' and the response provides a definition/explanation of what it means, addressing the single aspect requested.",PASS,TRUE
