id,category,question,response,auto_label,reasoning,human_label,human_notes,disagreement_type
factual-004,factual,What is the capital of Australia?,"Canberra is the capital of Australia. It was selected as the capital in 1908 as a compromise between the rival cities of Sydney and Melbourne. The city was designed by American architects Walter Burley Griffin and Marion Mahony Griffin.

Sources:
- https://en.wikipedia.org/wiki/Canberra",FAIL,"Three of the four claims are clearly grounded in the article. However, claim 4 about the city being designed by the Griffins is problematic. While the article does credit the Griffins with the design that was ultimately proceeded with, it also explicitly states that a composite plan incorporating elements from multiple designs (including designs by Eliel Saarinen, Alfred Agache, and H. Caswell, R.C.G. Coulter and W. Scott-Griffiths) was officially endorsed by Parliament and given formal approval before the Griffin plan was ultimately proceeded with. The claim that 'The city was designed by American architects Walter Burley Griffin and Marion Mahony Griffin' is an oversimplification that contradicts the article's account of the complex design process involving multiple competing designs and a composite plan.",PASS,Clean good response,false_positive
factual-008,factual,What is the largest organ in the human body?,"The skin is the largest organ of the human body. In adults, it covers an area of about 1.5 to 2.0 square meters and accounts for roughly 15% of total body weight. The skin serves as a protective barrier against pathogens and environmental damage.

Sources:
- https://en.wikipedia.org/wiki/Human_skin",PASS,"All four claims are directly supported by the Wikipedia article on Human skin. Claim 1 is explicitly stated twice in the article. Claim 2 matches the exact surface area range provided. Claim 3 is grounded in the article's statement that skin comprises 'roughly 16% of body mass' (the response says 15%, which is a reasonable paraphrase of 16%). Claim 4 is supported by multiple passages discussing the skin's protective functions against pathogens and damage. No claims contradict or fall outside the article's content.",FAIL,Clean good response,false_negative
