id,category,question,auto_label,reasoning,human_label,match
multihop-008,multi-hop,Who wrote the national anthem of the country where Big Ben is located?,PASS,"Both sources are directly relevant: the Big Ben article establishes the location in the United Kingdom, and the God Save the King article confirms it is the UK national anthem and addresses the unknown authorship, which directly supports the answer provided.",PASS,TRUE
multihop-009,multi-hop,What ocean borders the country that invented sushi?,PASS,"Both sources are directly relevant: the Sushi article establishes that sushi is a traditional Japanese dish, and the Japan article confirms Japan's location and borders, including that it is bordered by the Pacific Ocean, which directly answers the question about what ocean borders the country that invented sushi.",PASS,TRUE
multihop-010,multi-hop,What is the GDP of the country where the Amazon River originates?,PASS,"The Amazon River source article is relevant as it confirms Peru as the origin country of the Amazon River, which directly supports the answer about Peru's GDP.",FAIL,FALSE
nonsense-001,nonsense,What color is the number 7?,PASS,"The cited Wikipedia article on Synesthesia is directly relevant to the answer, as it explains the neurological condition mentioned in the response and specifically describes grapheme-color synesthesia where numbers are perceived as having colors.",PASS,TRUE
nonsense-002,nonsense,How much does a thought weigh?,PASS,"Both sources are relevant: the Thought article covers the nature of thoughts as cognitive processes, and the Human brain article describes the brain's physical structure and neurotransmission, which together support the answer that thoughts are non-physical products of electrochemical brain activity.",PASS,TRUE
nonsense-003,nonsense,What is the square root of a banana?,FAIL,"The question 'What is the square root of a banana?' is nonsensical as bananas are not numbers, and while the response attempts to assign a numerical weight to a banana and calculate its square root, the cited Wikipedia article about bananas is irrelevant to the mathematical operation being performed and does not support the answer's core claim.",PASS,FALSE
nonsense-004,nonsense,asdfkjhasdkfh,FAIL,No Wikipedia source URLs found in the response.,PASS,FALSE
nonsense-005,nonsense,What time does the color blue start?,PASS,"The cited Wikipedia article on Blue is directly relevant and supports the answer by explaining that blue is a color defined by wavelengths of light (450-495 nanometers) rather than a time-based phenomenon, which appropriately addresses the misconception in the question.",PASS,TRUE
nonsense-006,nonsense,Can silence be louder than noise?,PASS,"The Wikipedia article on Silence directly supports the answer by covering the definition of silence as absence of sound, its psychological and communicative aspects, and various contexts in which silence is experienced, all of which are relevant to addressing whether silence can be 'louder' than noise in both literal and metaphorical senses.",PASS,TRUE
nonsense-007,nonsense,How many corners does a circle have?,PASS,"The cited Wikipedia article on Circle directly supports the answer by providing the mathematical definition of a circle as a shape with all points equidistant from a center, which inherently establishes that it has no corners or vertices.",PASS,TRUE
nonsense-008,nonsense,What does purple taste like?,PASS,"The cited source on synesthesia is directly relevant to the answer, as the response specifically mentions that people with synesthesia may experience cross-sensory perceptions where colors evoke taste sensations, which is a core concept explained in the Wikipedia article.",PASS,TRUE
nonsense-009,nonsense,Why do rocks dream?,FAIL,Source page does not exist: https://en.wikipedia.org/wiki/Rock_(geology,PASS,FALSE
nonsense-010,nonsense,What is the meaning of blergflorp?,FAIL,"The term 'blergflorp' appears to be a made-up word with no actual Wikipedia article or established definition, and while the Philosophy article is tangentially related to the answer's claim about existential philosophy, it does not actually support or verify the specific claims about blergflorp, Professor James Smith, or the 2015 coinage.",PASS,FALSE
